{
  "agent_id": "L1-planning-impact-dependency-aggregator",
  "agent_version": "1.0.0",
  "execution_id": "exec-4a5b6c7d-8e9f-4a1b-2c3d-4e5f6a7b8c9d",
  "workflow_execution_id": "wf-8a1c2e3f-4b5d-6a7e-8f9a-0b1c2d3e4f5a",
  "status": "success",
  "content": {
    "type": "impact_dependency_aggregation",
    "schema_version": "1.0",
    "items": {
      "product_name": "Loyalty Points Gateway",
      "source_artifacts": {
        "impact_assessment": {
          "name": "L1-impact-assessment.md",
          "blob_storage_url": "https://blob.internal/loyalty-points-gateway/phase-1/L1-impact-assessment.md"
        },
        "dependency_graph_mmd": {
          "name": "L1-dependency-graph.mmd",
          "blob_storage_url": "https://blob.internal/loyalty-points-gateway/phase-1/L1-dependency-graph.mmd"
        }
      },
      "aggregation_method": "verbatim-concatenation",
      "sections_included": ["impact-assessment", "dependency-graph-mermaid"]
    },
    "artifacts": [
      {
        "id": "artifact-001",
        "type": "document",
        "name": "L1-impact-assessment-dependency-graph.md",
        "format": "markdown",
        "storage": {
          "provider": "s3",
          "location": "s3://phase1-artifacts/loyalty-points-gateway/phase-1/L1-impact-assessment-dependency-graph.md",
          "blob_storage_url": "https://blob.internal/loyalty-points-gateway/phase-1/L1-impact-assessment-dependency-graph.md"
        },
        "description": "Combined impact assessment and Mermaid dependency graph in a single markdown document.",
        "produced_by": "L1-planning-impact-dependency-aggregator"
      }
    ],
    "execution_summary": "• Produced: L1-impact-assessment-dependency-graph.md\n• Source artifacts consumed: L1-impact-assessment.md (https://blob.internal/loyalty-points-gateway/phase-1/L1-impact-assessment.md), L1-dependency-graph.mmd (https://blob.internal/loyalty-points-gateway/phase-1/L1-dependency-graph.mmd)\n• Product name: Loyalty Points Gateway — confirmed consistent across both sources\n• Tools invoked: blob storage reader x2 (L1-impact-assessment.md, L1-dependency-graph.mmd) — success; blob storage writer x1 — success\n• Guardrails evaluated: gr-L1-output-schema-validator (pass), gr-L1-pii-detection (pass)\n• Blob storage location: s3://phase1-artifacts/loyalty-points-gateway/phase-1/L1-impact-assessment-dependency-graph.md\n• Gaps flagged: none"
  }
}
